mysql> use faculty_data;
Database changed
mysql> desc faculty_data;
+----------+-------------+------+-----+---------+-------+
| Field    | Type        | Null | Key | Default | Extra |
+----------+-------------+------+-----+---------+-------+
| FacNo    | int(3)      | YES  |     | NULL    |       |
| FacName  | varchar(15) | YES  |     | NULL    |       |
| Gender   | varchar(1)  | YES  |     | NULL    |       |
| DOB      | int(11)     | YES  |     | NULL    |       |
| DOJ      | int(10)     | YES  |     | NULL    |       |
| MobileNO | int(10)     | YES  |     | NULL    |       |
| DeptNo   | varchar(4)  | YES  |     | NULL    |       |
+----------+-------------+------+-----+---------+-------+
7 rows in set (0.01 sec)

mysql> update faculty_data
    -> ADD Address varchar(25);
ERROR 1064 (42000): You have an error in your SQL syntax; check the manual that corresponds to your MySQL server version for the right syntax to use near 'ADD Address varchar(25)' at line 2
mysql> update faculty_data SET DOJ=11;
Query OK, 1 row affected (0.00 sec)
Rows matched: 1  Changed: 1  Warnings: 0

mysql> describe faculty_data;
+----------+-------------+------+-----+---------+-------+
| Field    | Type        | Null | Key | Default | Extra |
+----------+-------------+------+-----+---------+-------+
| FacNo    | int(3)      | YES  |     | NULL    |       |
| FacName  | varchar(15) | YES  |     | NULL    |       |
| Gender   | varchar(1)  | YES  |     | NULL    |       |
| DOB      | int(11)     | YES  |     | NULL    |       |
| DOJ      | int(10)     | YES  |     | NULL    |       |
| MobileNO | int(10)     | YES  |     | NULL    |       |
| DeptNo   | varchar(4)  | YES  |     | NULL    |       |
+----------+-------------+------+-----+---------+-------+
7 rows in set (0.01 sec)

mysql> select * from faculty_data;
+-------+---------+--------+------+------+----------+--------+
| FacNo | FacName | Gender | DOB  | DOJ  | MobileNO | DeptNo |
+-------+---------+--------+------+------+----------+--------+
|   203 | Joyce   | f      |   11 |   11 |   984037 | AI     |
+-------+---------+--------+------+------+----------+--------+
1 row in set (0.00 sec)

mysql> DELETE FROM faculty_data SET DOJ=11;
ERROR 1064 (42000): You have an error in your SQL syntax; check the manual that corresponds to your MySQL server version for the right syntax to use near 'SET DOJ=11' at line 1
mysql> DELETE FROM faculty_data DOJ;
ERROR 1064 (42000): You have an error in your SQL syntax; check the manual that corresponds to your MySQL server version for the right syntax to use near 'DOJ' at line 1
mysql> DELETE FROM faculty_data;
Query OK, 1 row affected (0.00 sec)

mysql> desc faculty_data;
+----------+-------------+------+-----+---------+-------+
| Field    | Type        | Null | Key | Default | Extra |
+----------+-------------+------+-----+---------+-------+
| FacNo    | int(3)      | YES  |     | NULL    |       |
| FacName  | varchar(15) | YES  |     | NULL    |       |
| Gender   | varchar(1)  | YES  |     | NULL    |       |
| DOB      | int(11)     | YES  |     | NULL    |       |
| DOJ      | int(10)     | YES  |     | NULL    |       |
| MobileNO | int(10)     | YES  |     | NULL    |       |
| DeptNo   | varchar(4)  | YES  |     | NULL    |       |
+----------+-------------+------+-----+---------+-------+
7 rows in set (0.01 sec)

mysql> select * from faculty_data;
Empty set (0.00 sec)